{
  "question_set_schema_version": "1.0",
  "dataset_id": "uae-procurement-cited-questions-synthetic",
  "dataset_version": "0.1.0",
  "purpose": "Development-only evaluation of page-grounded answers, refusals, paraphrase retrieval, and organization isolation over the Phase 4 pack.",
  "synthetic": true,
  "claim_eligible": false,
  "claim_exclusion_reason": "Generated synthetic procurement documents do not represent real UAE invoices, production traffic, or real-world RAG performance.",
  "source_pack": {
    "dataset_id": "uae-procurement-reconciliation-synthetic",
    "dataset_version": "0.1.0",
    "truth_set_path": "output/pdf/uae-procurement-reconciliation-v0.1.0/truth-set.json",
    "truth_set_sha256": "42ad22a9fcb7e1e0e3094a070d86e27c2b7b8fd82fa1a8b983bf3a60eb6619d5"
  },
  "coverage_requirements": {
    "single_document": 12,
    "cross_document": 6,
    "paraphrase": 6,
    "unanswerable": 3,
    "adversarial_isolation": 3
  },
  "sources": [
    {
      "source_id": "quotation-primary",
      "organization_fixture": "org-primary",
      "review_fixture_id": "review-quotation-v1",
      "role": "Quotation",
      "path": "output/pdf/uae-procurement-reconciliation-v0.1.0/synthetic-quotation-Q-260801.pdf",
      "sha256": "d8b502341da89dacffd763e4ec562a2bdf9fc2e2c5836ea1230a64121b10e636",
      "license": "CC0-1.0",
      "synthetic": true,
      "canonicalization": {
        "adapter": "local-procurement-v1",
        "version": "local-1.2.0"
      },
      "pages": [
        {
          "page_number": 1,
          "canonical_text_sha256": "44b48e6afca177c1ff1c3fb4dc311fd7b9c80d910c320af2a9b78ffafd9b2b32"
        }
      ]
    },
    {
      "source_id": "purchase-order-primary",
      "organization_fixture": "org-primary",
      "review_fixture_id": "review-purchase-order-v1",
      "role": "PurchaseOrder",
      "path": "output/pdf/uae-procurement-reconciliation-v0.1.0/synthetic-purchase-order-PO-260801.pdf",
      "sha256": "fb83571835445e42a7f74402193996acbacb931460cb495ea0beeb4fedcbbb0f",
      "license": "CC0-1.0",
      "synthetic": true,
      "canonicalization": {
        "adapter": "local-procurement-v1",
        "version": "local-1.2.0"
      },
      "pages": [
        {
          "page_number": 1,
          "canonical_text_sha256": "3752b4d67a8613f59e913f1bd505e566fd606efa4c09c19030c938992493cd7b"
        }
      ]
    },
    {
      "source_id": "invoice-primary",
      "organization_fixture": "org-primary",
      "review_fixture_id": "review-invoice-v1",
      "role": "Invoice",
      "path": "output/pdf/uae-procurement-reconciliation-v0.1.0/synthetic-tax-invoice-SYN-STD-260801.pdf",
      "sha256": "9826c848ebf08933bc93bcc98626745c7eff02c71e1202e507f8f3aa074f42a2",
      "license": "CC0-1.0",
      "synthetic": true,
      "canonicalization": {
        "adapter": "local-procurement-v1",
        "version": "local-1.2.0"
      },
      "pages": [
        {
          "page_number": 1,
          "canonical_text_sha256": "b5858deac6ed33dfa201972f87ccd144341b5bac208613abe1e179615ec11464"
        },
        {
          "page_number": 2,
          "canonical_text_sha256": "da3cafb5dadf4a97c3dee6aa4520e4ebe96b33fade93b0d6411e3d954796b6ba"
        }
      ]
    },
    {
      "source_id": "invoice-foreign",
      "organization_fixture": "org-foreign",
      "review_fixture_id": "review-invoice-foreign-v1",
      "role": "Invoice",
      "path": "output/pdf/uae-procurement-reconciliation-v0.1.0/synthetic-tax-invoice-SYN-STD-260801.pdf",
      "sha256": "9826c848ebf08933bc93bcc98626745c7eff02c71e1202e507f8f3aa074f42a2",
      "license": "CC0-1.0",
      "synthetic": true,
      "canonicalization": {
        "adapter": "local-procurement-v1",
        "version": "local-1.2.0"
      },
      "pages": [
        {
          "page_number": 1,
          "canonical_text_sha256": "b5858deac6ed33dfa201972f87ccd144341b5bac208613abe1e179615ec11464"
        },
        {
          "page_number": 2,
          "canonical_text_sha256": "da3cafb5dadf4a97c3dee6aa4520e4ebe96b33fade93b0d6411e3d954796b6ba"
        }
      ]
    }
  ],
  "questions": [
    {
      "question_id": "p5-q-001",
      "category": "single_document",
      "question": "What is the quotation number?",
      "scope": {
        "organization_fixture": "org-primary",
        "allowed_source_ids": [
          "quotation-primary"
        ],
        "forbidden_source_ids": []
      },
      "expected": {
        "status": "Answered",
        "reason_code": null,
        "claims": [
          {
            "claim_id": "c1",
            "text": "The quotation number is Q-260801.",
            "evidence": [
              {
                "source_id": "quotation-primary",
                "page_number": 1,
                "quote": "Quotation Number: Q-260801",
                "provenance_type": "PageText",
                "field_key": "quotation_number",
                "occurrence": 0
              }
            ]
          }
        ]
      },
      "security_tags": []
    },
    {
      "question_id": "p5-q-002",
      "category": "single_document",
      "question": "What is the quotation total?",
      "scope": {
        "organization_fixture": "org-primary",
        "allowed_source_ids": [
          "quotation-primary"
        ],
        "forbidden_source_ids": []
      },
      "expected": {
        "status": "Answered",
        "reason_code": null,
        "claims": [
          {
            "claim_id": "c1",
            "text": "The quotation total is AED 8,820.00.",
            "evidence": [
              {
                "source_id": "quotation-primary",
                "page_number": 1,
                "quote": "Total: 8820.00",
                "provenance_type": "PageText",
                "field_key": "total",
                "occurrence": 0
              },
              {
                "source_id": "quotation-primary",
                "page_number": 1,
                "quote": "Currency: AED",
                "provenance_type": "PageText",
                "field_key": "currency",
                "occurrence": 0
              }
            ]
          }
        ]
      },
      "security_tags": []
    },
    {
      "question_id": "p5-q-003",
      "category": "single_document",
      "question": "How much VAT is shown on the quotation?",
      "scope": {
        "organization_fixture": "org-primary",
        "allowed_source_ids": [
          "quotation-primary"
        ],
        "forbidden_source_ids": []
      },
      "expected": {
        "status": "Answered",
        "reason_code": null,
        "claims": [
          {
            "claim_id": "c1",
            "text": "The quotation shows AED 420.00 VAT.",
            "evidence": [
              {
                "source_id": "quotation-primary",
                "page_number": 1,
                "quote": "VAT: 420.00",
                "provenance_type": "PageText",
                "field_key": "vat",
                "occurrence": 0
              },
              {
                "source_id": "quotation-primary",
                "page_number": 1,
                "quote": "Currency: AED",
                "provenance_type": "PageText",
                "field_key": "currency",
                "occurrence": 0
              }
            ]
          }
        ]
      },
      "security_tags": []
    },
    {
      "question_id": "p5-q-004",
      "category": "single_document",
      "question": "What is the purchase order number?",
      "scope": {
        "organization_fixture": "org-primary",
        "allowed_source_ids": [
          "purchase-order-primary"
        ],
        "forbidden_source_ids": []
      },
      "expected": {
        "status": "Answered",
        "reason_code": null,
        "claims": [
          {
            "claim_id": "c1",
            "text": "The purchase order number is PO-260801.",
            "evidence": [
              {
                "source_id": "purchase-order-primary",
                "page_number": 1,
                "quote": "Purchase Order Number: PO-260801",
                "provenance_type": "PageText",
                "field_key": "purchase_order_number",
                "occurrence": 0
              }
            ]
          }
        ]
      },
      "security_tags": []
    },
    {
      "question_id": "p5-q-005",
      "category": "single_document",
      "question": "What is the purchase order total?",
      "scope": {
        "organization_fixture": "org-primary",
        "allowed_source_ids": [
          "purchase-order-primary"
        ],
        "forbidden_source_ids": []
      },
      "expected": {
        "status": "Answered",
        "reason_code": null,
        "claims": [
          {
            "claim_id": "c1",
            "text": "The purchase order total is AED 8,925.00.",
            "evidence": [
              {
                "source_id": "purchase-order-primary",
                "page_number": 1,
                "quote": "Total: 8925.00",
                "provenance_type": "PageText",
                "field_key": "total",
                "occurrence": 0
              },
              {
                "source_id": "purchase-order-primary",
                "page_number": 1,
                "quote": "Currency: AED",
                "provenance_type": "PageText",
                "field_key": "currency",
                "occurrence": 0
              }
            ]
          }
        ]
      },
      "security_tags": []
    },
    {
      "question_id": "p5-q-006",
      "category": "single_document",
      "question": "What unit price does the purchase order use for the training line?",
      "scope": {
        "organization_fixture": "org-primary",
        "allowed_source_ids": [
          "purchase-order-primary"
        ],
        "forbidden_source_ids": []
      },
      "expected": {
        "status": "Answered",
        "reason_code": null,
        "claims": [
          {
            "claim_id": "c1",